{
  "$schema": "https://json-schema.org/draft/2020-12/schema",
  "type": "object",
  "properties": {
    "id": { "type": "string", "pattern": "^[a-z0-9][a-z0-9._-]*$" },
    "status": {
      "type": "string",
      "enum": ["experimental", "qualified", "expired"]
    },
    "testedAt": {
      "type": "string",
      "format": "date-time",
      "pattern": "^(?:(?:\\d\\d[2468][048]|\\d\\d[13579][26]|\\d\\d0[48]|[02468][048]00|[13579][26]00)-02-29|\\d{4}-(?:(?:0[13578]|1[02])-(?:0[1-9]|[12]\\d|3[01])|(?:0[469]|11)-(?:0[1-9]|[12]\\d|30)|(?:02)-(?:0[1-9]|1\\d|2[0-8])))T(?:(?:[01]\\d|2[0-3]):[0-5]\\d:[0-5]\\d(?:\\.\\d+)?(?:Z))$"
    },
    "expiresAt": {
      "type": "string",
      "format": "date-time",
      "pattern": "^(?:(?:\\d\\d[2468][048]|\\d\\d[13579][26]|\\d\\d0[48]|[02468][048]00|[13579][26]00)-02-29|\\d{4}-(?:(?:0[13578]|1[02])-(?:0[1-9]|[12]\\d|3[01])|(?:0[469]|11)-(?:0[1-9]|[12]\\d|30)|(?:02)-(?:0[1-9]|1\\d|2[0-8])))T(?:(?:[01]\\d|2[0-3]):[0-5]\\d:[0-5]\\d(?:\\.\\d+)?(?:Z))$"
    },
    "host": {
      "type": "object",
      "properties": {
        "os": { "type": "string", "minLength": 1 },
        "architecture": { "type": "string", "minLength": 1 }
      },
      "required": ["os", "architecture"],
      "additionalProperties": false
    },
    "runtime": {
      "type": "object",
      "properties": {
        "node": {
          "type": "string",
          "pattern": "^(?:0|[1-9]\\d*)\\.(?:0|[1-9]\\d*)\\.(?:0|[1-9]\\d*)(?:-(?:0|[1-9]\\d*|\\d*[A-Za-z-][0-9A-Za-z-]*)(?:\\.(?:0|[1-9]\\d*|\\d*[A-Za-z-][0-9A-Za-z-]*))*)?(?:\\+[0-9A-Za-z-]+(?:\\.[0-9A-Za-z-]+)*)?$"
        },
        "npm": {
          "type": "string",
          "pattern": "^(?:0|[1-9]\\d*)\\.(?:0|[1-9]\\d*)\\.(?:0|[1-9]\\d*)(?:-(?:0|[1-9]\\d*|\\d*[A-Za-z-][0-9A-Za-z-]*)(?:\\.(?:0|[1-9]\\d*|\\d*[A-Za-z-][0-9A-Za-z-]*))*)?(?:\\+[0-9A-Za-z-]+(?:\\.[0-9A-Za-z-]+)*)?$"
        }
      },
      "required": ["node", "npm"],
      "additionalProperties": false
    },
    "container": {
      "type": "object",
      "properties": {
        "engine": { "type": "string", "minLength": 1 },
        "version": { "type": "string", "minLength": 1 },
        "verifierImage": {
          "type": "string",
          "pattern": "^[^@\\s]+@sha256:[a-f0-9]{64}$"
        }
      },
      "required": ["engine", "version", "verifierImage"],
      "additionalProperties": false
    },
    "worker": {
      "type": "object",
      "properties": {
        "adapter": { "type": "string", "const": "codex-cli" },
        "harnessVersion": { "type": "string", "minLength": 1 },
        "modelIdentity": { "type": "string", "const": "provider-mutable" },
        "authMode": { "type": "string", "const": "operator-session" }
      },
      "required": ["adapter", "harnessVersion", "modelIdentity", "authMode"],
      "additionalProperties": false
    },
    "forge": {
      "type": "object",
      "properties": {
        "gitVersion": { "type": "string", "minLength": 1 },
        "ghVersion": { "type": "string", "minLength": 1 },
        "host": { "type": "string", "const": "github.com" }
      },
      "required": ["gitVersion", "ghVersion", "host"],
      "additionalProperties": false
    },
    "recipe": {
      "type": "object",
      "properties": {
        "id": { "type": "string", "const": "node-typescript-next-web" },
        "version": {
          "type": "string",
          "pattern": "^(?:0|[1-9]\\d*)\\.(?:0|[1-9]\\d*)\\.(?:0|[1-9]\\d*)(?:-(?:0|[1-9]\\d*|\\d*[A-Za-z-][0-9A-Za-z-]*)(?:\\.(?:0|[1-9]\\d*|\\d*[A-Za-z-][0-9A-Za-z-]*))*)?(?:\\+[0-9A-Za-z-]+(?:\\.[0-9A-Za-z-]+)*)?$"
        },
        "digest": { "type": "string", "pattern": "^sha256:[a-f0-9]{64}$" }
      },
      "required": ["id", "version", "digest"],
      "additionalProperties": false
    }
  },
  "required": [
    "id",
    "status",
    "testedAt",
    "expiresAt",
    "host",
    "runtime",
    "container",
    "worker",
    "forge",
    "recipe"
  ],
  "additionalProperties": false,
  "$id": "https://github.com/davidahmann/mill/schemas/support-tuple.schema.json",
  "title": "SupportTuple"
}
